{
  "client_id": "94642acb-4996-034b-916c-147da723cc41",
  "event": "IMPRESSION",
  "event_context": "n/a",
  "message_id": "TRAILHEAD_CARD_1",
  "locale": "en-US",
  "version": "71.0a1",
  "release_channel": "nightly",
  "addon_version": "20181206092619",
  "profile_creation_date": 17817,
  "experiments": {
    "exp_id_foo": {
      "branch": "control"
    },
    "exp_id_bar": {
      "branch": "treatment"
    }
  }
}
